{
  "id": "merge-intervals",
  "title": "Merge intervals",
  "language": "python",
  "level": "hard",
  "description": "merge_intervals(intervals) merges overlapping or touching [start, end] intervals - [[1, 3], [2, 6], [8, 10], [6, 7]] becomes [[1, 7], [8, 10]]. The input list and the intervals inside it must not change. free_slots uses it to list the gaps in a day that no interval covers.",
  "hint": "Think about the order the intervals are visited in, an interval that sits fully inside another, touching ends, and what is shared with the input.",
  "bugCount": 4,
  "timeLimitSec": 480,
  "basePoints": 300,
  "tags": ["intervals", "sorting", "aliasing", "boundary"]
}
